[
  {
    "asset_id": "KING_DRUM",
    "kind": "archive",
    "status": "unknown",
    "rights_owner": "King Estate / IPM; recording owner to establish",
    "evidence_path": null,
    "evidence_sha256": null,
    "media_path": null,
    "media_sha256": null,
    "reviewer": null,
    "context_approved": false,
    "publish_approved": false,
    "contact": "licensing@i-p-m.com",
    "notes": "King Estate and recording rights; obtain authorization/review"
  },
  {
    "asset_id": "REAGAN_XMAS",
    "kind": "archive",
    "status": "unknown",
    "rights_owner": "NARA / White House Television Office provenance lead",
    "evidence_path": null,
    "evidence_sha256": null,
    "media_path": null,
    "media_sha256": null,
    "reviewer": null,
    "context_approved": false,
    "publish_approved": false,
    "contact": "reagan.library@nara.gov",
    "notes": "Confirm recording and its legal status"
  },
  {
    "asset_id": "JFK_TREE",
    "kind": "archive",
    "status": "unknown",
    "rights_owner": null,
    "evidence_path": null,
    "evidence_sha256": null,
    "media_path": null,
    "media_sha256": null,
    "reviewer": null,
    "context_approved": false,
    "publish_approved": false,
    "contact": null,
    "notes": "Not direct testimony about Jesus; label context-only"
  },
  {
    "asset_id": "BUSH_DEBATE",
    "kind": "archive",
    "status": "unknown",
    "rights_owner": null,
    "evidence_path": null,
    "evidence_sha256": null,
    "media_path": null,
    "media_sha256": null,
    "reviewer": null,
    "context_approved": false,
    "publish_approved": false,
    "contact": null,
    "notes": "C-SPAN rights"
  },
  {
    "asset_id": "ELIZABETH_XMAS",
    "kind": "archive",
    "status": "unknown",
    "rights_owner": null,
    "evidence_path": null,
    "evidence_sha256": null,
    "media_path": null,
    "media_sha256": null,
    "reviewer": null,
    "context_approved": false,
    "publish_approved": false,
    "contact": null,
    "notes": "Broadcaster rights"
  },
  {
    "asset_id": "OBAMA_EASTER",
    "kind": "archive",
    "status": "unknown",
    "rights_owner": null,
    "evidence_path": null,
    "evidence_sha256": null,
    "media_path": null,
    "media_sha256": null,
    "reviewer": null,
    "context_approved": false,
    "publish_approved": false,
    "contact": null,
    "notes": "Confirm footage"
  },
  {
    "asset_id": "MANDELA_EASTER",
    "kind": "archive",
    "status": "unknown",
    "rights_owner": null,
    "evidence_path": null,
    "evidence_sha256": null,
    "media_path": null,
    "media_sha256": null,
    "reviewer": null,
    "context_approved": false,
    "publish_approved": false,
    "contact": null,
    "notes": "Transcript lead; matching footage not confirmed"
  },
  {
    "asset_id": "COLLINS_TESTIMONY",
    "kind": "archive",
    "status": "unknown",
    "rights_owner": "BioLogos; confirm underlying production rights",
    "evidence_path": null,
    "evidence_sha256": null,
    "media_path": null,
    "media_sha256": null,
    "reviewer": null,
    "context_approved": false,
    "publish_approved": false,
    "contact": null,
    "notes": "Producer permission"
  },
  {
    "asset_id": "LENNOX_RESURRECTION",
    "kind": "archive",
    "status": "unknown",
    "rights_owner": null,
    "evidence_path": null,
    "evidence_sha256": null,
    "media_path": null,
    "media_sha256": null,
    "reviewer": null,
    "context_approved": false,
    "publish_approved": false,
    "contact": null,
    "notes": "Verify source and permissions; identify as mathematician"
  },
  {
    "asset_id": "BONO_MEANING",
    "kind": "archive",
    "status": "unknown",
    "rights_owner": "RTÉ; confirm all licensors",
    "evidence_path": null,
    "evidence_sha256": null,
    "media_path": null,
    "media_sha256": null,
    "reviewer": null,
    "context_approved": false,
    "publish_approved": false,
    "contact": null,
    "notes": "Broadcaster rights; verify full original"
  },
  {
    "asset_id": "CARREY_HOMEBOY",
    "kind": "archive",
    "status": "unknown",
    "rights_owner": "Homeboy Industries is an acquisition lead, not a verified owner",
    "evidence_path": null,
    "evidence_sha256": null,
    "media_path": null,
    "media_sha256": null,
    "reviewer": null,
    "context_approved": false,
    "publish_approved": false,
    "contact": "marketingteam@homeboyindustries.org",
    "notes": "Context and producer permission"
  },
  {
    "asset_id": "DENZEL_BERNARD",
    "kind": "archive",
    "status": "unknown",
    "rights_owner": null,
    "evidence_path": null,
    "evidence_sha256": null,
    "media_path": null,
    "media_sha256": null,
    "reviewer": null,
    "context_approved": false,
    "publish_approved": false,
    "contact": null,
    "notes": "Social excerpt; find full source"
  },
  {
    "asset_id": "CURRY_MVP",
    "kind": "archive",
    "status": "unknown",
    "rights_owner": null,
    "evidence_path": null,
    "evidence_sha256": null,
    "media_path": null,
    "media_sha256": null,
    "reviewer": null,
    "context_approved": false,
    "publish_approved": false,
    "contact": null,
    "notes": "NBA/broadcast rights"
  },
  {
    "asset_id": "SCHEFFLER_MASTERS",
    "kind": "archive",
    "status": "unknown",
    "rights_owner": "Masters / Augusta National and recording producer; confirm",
    "evidence_path": null,
    "evidence_sha256": null,
    "media_path": null,
    "media_sha256": null,
    "reviewer": null,
    "context_approved": false,
    "publish_approved": false,
    "contact": null,
    "notes": "Transcript is not footage permission"
  },
  {
    "asset_id": "KAKA_SECOND",
    "kind": "archive",
    "status": "unknown",
    "rights_owner": null,
    "evidence_path": null,
    "evidence_sha256": null,
    "media_path": null,
    "media_sha256": null,
    "reviewer": null,
    "context_approved": false,
    "publish_approved": false,
    "contact": null,
    "notes": "Producer rights"
  },
  {
    "asset_id": "FRY_QUESTION",
    "kind": "archive",
    "status": "unknown",
    "rights_owner": "RTÉ; confirm all licensors",
    "evidence_path": null,
    "evidence_sha256": null,
    "media_path": null,
    "media_sha256": null,
    "reviewer": null,
    "context_approved": false,
    "publish_approved": false,
    "contact": null,
    "notes": "RTÉ rights; broader theism, not testimony about Jesus"
  },
  {
    "asset_id": "DESIGN",
    "kind": "original_design",
    "status": "unknown",
    "rights_owner": null,
    "evidence_path": null,
    "evidence_sha256": null,
    "media_path": null,
    "media_sha256": null,
    "reviewer": null,
    "context_approved": false,
    "publish_approved": false,
    "contact": null,
    "notes": "Original procedural geometry and editorial text. Human release review pending."
  },
  {
    "asset_id": "FONTS",
    "kind": "font",
    "status": "unknown",
    "rights_owner": null,
    "evidence_path": null,
    "evidence_sha256": null,
    "media_path": null,
    "media_sha256": null,
    "reviewer": null,
    "context_approved": false,
    "publish_approved": false,
    "contact": null,
    "notes": "EB Garamond and Manrope, SIL OFL 1.1. See assets/design/font_manifest.json. Human release review pending."
  },
  {
    "asset_id": "SCRIPTURE_WEB",
    "kind": "quotation",
    "status": "unknown",
    "rights_owner": null,
    "evidence_path": null,
    "evidence_sha256": null,
    "media_path": null,
    "media_sha256": null,
    "reviewer": null,
    "context_approved": false,
    "publish_approved": false,
    "contact": null,
    "notes": "World English Bible Classic, Mark 8:29a. Publisher public-domain statement researched; human translation and context approval pending."
  }
]
